{
  "specversion": "1.0",
  "id": "pms-000503",
  "source": "urn:hos:pms:demo",
  "type": "stay.checked_out",
  "time": "2026-07-30T08:47:00Z",
  "datacontenttype": "application/json",
  "hosschemaversion": "0.1",
  "hosrecordedat": "2026-07-30T08:47:00.500Z",
  "hostenant": "tenant_demo",
  "hosproperty": "prop_demo",
  "hospropertytimezone": "Europe/Paris",
  "hosbusinessdate": "2026-07-30",
  "hossubjects": "stay:stay_0977 unit:unit_311",
  "data": {
    "stay_id": "stay_0977",
    "unit_id": "unit_311"
  }
}
